{
  "schema": "pr4109/r00-reproduction-catalog/v1",
  "version": 1,
  "baseline_source_commit": "1bc7edf9965cac43de3bd18060e07ba678670073",
  "evaluated_candidate_commit": "d7bf8c0753f3aac574f8d20d93c75268f350b389",
  "status": "blocked",
  "cases": [
    {
      "id": "R00-01",
      "kind": "negative",
      "title": "Candidate nominal-legacy ZK proof versus historical verifier",
      "predicate": "A nominal-legacy ZK proof generated by the candidate TSS revision is rejected by the exact PRIOR verification equation for the transcript mismatch, not by decode failure, timeout, or panic.",
      "source_anchors": [
        {
          "repository": "threshold-network/tss-lib",
          "commit": "d847ce0030193ccf5dbec0097571dcce5a2a5cf6",
          "path": "crypto/schnorr/schnorr_proof.go",
          "symbol": "func NewZKProofWithSession("
        },
        {
          "repository": "threshold-network/tss-lib",
          "commit": "2e712689cfbeefede15f95a0ec7112227d86f702",
          "path": "crypto/schnorr/schnorr_proof.go",
          "symbol": "func (pf *ZKProof) Verify("
        }
      ],
      "baseline_evidence": {
        "status": "not_run",
        "controls": [],
        "blockers": ["No retained two-binary or fixed-vector cross-version result is bound to this catalog."]
      },
      "head_assessment": {
        "evaluated_commit": "d7bf8c0753f3aac574f8d20d93c75268f350b389",
        "status": "unknown",
        "basis": "none",
        "evidence_refs": [],
        "limitations": ["The cross-version predicate was not rerun on the evaluated candidate."]
      },
      "release_gate": "blocking"
    },
    {
      "id": "R00-02",
      "kind": "negative",
      "title": "Historical ZK proof versus candidate nominal-legacy verifier",
      "predicate": "A PRIOR ZK proof is rejected by the candidate nominal-legacy verification equation for the transcript mismatch, not by decode failure, timeout, or panic.",
      "source_anchors": [
        {
          "repository": "threshold-network/tss-lib",
          "commit": "d847ce0030193ccf5dbec0097571dcce5a2a5cf6",
          "path": "crypto/schnorr/schnorr_proof.go",
          "symbol": "func (pf *ZKProof) VerifyWithSession("
        },
        {
          "repository": "threshold-network/tss-lib",
          "commit": "2e712689cfbeefede15f95a0ec7112227d86f702",
          "path": "crypto/schnorr/schnorr_proof.go",
          "symbol": "func NewZKProof("
        }
      ],
      "baseline_evidence": {
        "status": "not_run",
        "controls": [],
        "blockers": ["No retained reverse-direction cross-version result is bound to this catalog."]
      },
      "head_assessment": {
        "evaluated_commit": "d7bf8c0753f3aac574f8d20d93c75268f350b389",
        "status": "unknown",
        "basis": "none",
        "evidence_refs": [],
        "limitations": ["The cross-version predicate was not rerun on the evaluated candidate."]
      },
      "release_gate": "blocking"
    },
    {
      "id": "R00-03",
      "kind": "negative",
      "title": "ZKV cross-version isolation and mixed signing",
      "predicate": "Both ZKV transcript directions reject and a complete mixed exact-binary signing attempt cannot produce a valid signature; each failure must match the transcript predicate.",
      "source_anchors": [
        {
          "repository": "threshold-network/tss-lib",
          "commit": "d847ce0030193ccf5dbec0097571dcce5a2a5cf6",
          "path": "crypto/schnorr/schnorr_proof.go",
          "symbol": "func (pf *ZKVProof) VerifyWithSession("
        },
        {
          "repository": "threshold-network/keep-core",
          "commit": "1bc7edf9965cac43de3bd18060e07ba678670073",
          "path": "pkg/tecdsa/signing/member.go",
          "symbol": "ConfigureTSSParameters("
        }
      ],
      "baseline_evidence": {
        "status": "not_run",
        "controls": [],
        "blockers": ["No retained exact-binary mixed signing run covers both ZKV directions and terminal signature validity."]
      },
      "head_assessment": {
        "evaluated_commit": "d7bf8c0753f3aac574f8d20d93c75268f350b389",
        "status": "unknown",
        "basis": "none",
        "evidence_refs": [],
        "limitations": ["Single-fork cross-mode unit tests are not the named exact-binary predicate."]
      },
      "release_gate": "blocking"
    },
    {
      "id": "R00-04",
      "kind": "negative",
      "title": "Cached height masks direct Ethereum RPC loss",
      "predicate": "While the cached block counter still returns a height and the direct Ethereum endpoint is unavailable, the baseline gate issues a permit and stays open without an authoritative read.",
      "source_anchors": [
        {
          "repository": "threshold-network/keep-core",
          "commit": "1bc7edf9965cac43de3bd18060e07ba678670073",
          "path": "pkg/protocol/participation/gate.go",
          "symbol": "func (g *chainGate) readClock("
        }
      ],
      "baseline_evidence": {
        "status": "not_run",
        "controls": [],
        "blockers": ["The discarded prototype had a runnable partial control, but no retained baseline evidence artifact is bound here."]
      },
      "head_assessment": {
        "evaluated_commit": "d7bf8c0753f3aac574f8d20d93c75268f350b389",
        "status": "resolved",
        "basis": "runtime_test",
        "evidence_refs": [
          {
            "commit": "d7bf8c0753f3aac574f8d20d93c75268f350b389",
            "path": "pkg/chain/authoritative_clock.go",
          "symbol": "type AuthoritativeClock interface"
          },
          {
            "commit": "d7bf8c0753f3aac574f8d20d93c75268f350b389",
            "path": "pkg/protocol/participation/gate_test.go",
          "symbol": "func TestGate_SupervisorUsesAuthoritativeClockNotCache("
          }
        ],
        "limitations": ["This resolves the keep-core gate path; deployment wiring and live endpoint-loss evidence remain separate release predicates."]
      },
      "release_gate": "blocking"
    },
    {
      "id": "R00-05",
      "kind": "negative",
      "title": "Same-height replacement is invisible to a number-only permit",
      "predicate": "Two histories with different canonical hashes at one height remain indistinguishable to the baseline permit because its anchor and issuance API contain only a block number.",
      "source_anchors": [
        {
          "repository": "threshold-network/keep-core",
          "commit": "1bc7edf9965cac43de3bd18060e07ba678670073",
          "path": "pkg/protocol/participation/gate.go",
          "symbol": "func (p *permit) CanonicalStartBlock("
        }
      ],
      "baseline_evidence": {
        "status": "not_run",
        "controls": [],
        "blockers": ["No retained same-height replacement evidence artifact is bound here."]
      },
      "head_assessment": {
        "evaluated_commit": "d7bf8c0753f3aac574f8d20d93c75268f350b389",
        "status": "present",
        "basis": "source_review",
        "evidence_refs": [
          {
            "commit": "d7bf8c0753f3aac574f8d20d93c75268f350b389",
            "path": "pkg/protocol/participation/gate.go",
            "symbol": "func (p *permit) CanonicalStartBlock("
          },
          {
            "commit": "d7bf8c0753f3aac574f8d20d93c75268f350b389",
            "path": "pkg/protocol/participation/gate.go",
            "symbol": "func (g *chainGate) Begin("
          }
        ],
        "limitations": ["Source review establishes the missing hash field, not a complete live reorg reproduction."]
      },
      "release_gate": "blocking"
    },
    {
      "id": "R00-06",
      "kind": "negative",
      "title": "Crash-point state exists only in memory",
      "predicate": "Crashes before and after permit issuance, threshold persistence, Bitcoin send, Ethereum send, signer activation, and terminal write identify every correctness-relevant state that the baseline cannot reconstruct.",
      "source_anchors": [
        {
          "repository": "threshold-network/keep-core",
          "commit": "1bc7edf9965cac43de3bd18060e07ba678670073",
          "path": "pkg/protocol/participation/gate.go",
          "symbol": "func (g *chainGate) issue("
        }
      ],
      "baseline_evidence": {
        "status": "not_run",
        "controls": [],
        "blockers": ["The complete process-crash matrix and retained storage/chain observations have not been produced."]
      },
      "head_assessment": {
        "evaluated_commit": "d7bf8c0753f3aac574f8d20d93c75268f350b389",
        "status": "unknown",
        "basis": "none",
        "evidence_refs": [],
        "limitations": ["The crash matrix was not rerun on the evaluated candidate."]
      },
      "release_gate": "blocking"
    },
    {
      "id": "R00-07",
      "kind": "negative",
      "title": "Non-signal runtime return skips durable quiesce",
      "predicate": "A non-signal runtime error after gate construction does not execute the same durable quiesce sequence as the signal path.",
      "source_anchors": [
        {
          "repository": "threshold-network/keep-core",
          "commit": "1bc7edf9965cac43de3bd18060e07ba678670073",
          "path": "cmd/start.go",
          "symbol": "func startSignalLifecycleController("
        }
      ],
      "baseline_evidence": {
        "status": "not_run",
        "controls": [],
        "blockers": ["No retained test drives the actual runtime controller through the named non-signal return."]
      },
      "head_assessment": {
        "evaluated_commit": "d7bf8c0753f3aac574f8d20d93c75268f350b389",
        "status": "present",
        "basis": "source_review",
        "evidence_refs": [
          {
            "commit": "d7bf8c0753f3aac574f8d20d93c75268f350b389",
            "path": "cmd/start.go",
            "symbol": "func startSignalLifecycleController("
          }
        ],